name,from,bio
"Suzanne Webb","Creative Writer, Southwestern College","Suzanne Webb tells
stories. Her stories mix, mesh, and merge alphabetic texts and images with her
“plain-talkin' self”. Her works have been featured in Computers & Composition,
Calliope, and Harlot of the Arts. She seeks to reach academic and nonacademic
audiences alike as she discusses the professional by using the personal."
"Christopher White","Associate Professor, Governors State
University","Christopher White is an Associate Professor of English at
Governors State University, located south of Chicago. He has published articles
on William Faulkner and Cormac McCarthy in the Journal of Modern Literature,
Southwestern American Literature, The Cormac McCarthy Journal, and Studies in
the Novel."
"Tom Winchester","Professor, Ringling College of Art and Design Department of
Photography and Imaging","Tom Winchester has presented papers titled,
“Himself's Figurants” and “Infinite Jest as an Art Object” at previous DFW
Conventions. He currently teaches photography at Ringling College of Art and
Design in Sarasota, Florida."
"Carly Yingst","Ph.D. Student, Harvard University","Carly Yingst is a
first-year PhD student in English at Harvard University, studying 20th century
American literature and the novel. She received her BA in English from Indiana
University, where she wrote her thesis on motion and (dis)orientation in David
Foster Wallace and Thomas Pynchon."
